SKU,Name,Type,Published,Featured,Visibility,Description,Short Description,Tax status,Stock,Regular price,Sale price,Categories,Tags,Images,Weight,Length,Width,Height
PROD-001,Camiseta Básica Branca,simple,1,0,visible,"Camiseta 100% algodão com modelagem confortável. Ideal para o dia a dia.","Camiseta 100% algodão",taxable,100,29.90,,Roupas > Camisetas,"casual,basico,algodao",camiseta-001.jpg|camiseta-001-2.jpg,0.2,30,20,5
PROD-002,Calça Jeans Masculina,simple,1,0,visible,"Calça jeans com modelagem moderna e acabamento de qualidade. Diversos tamanhos disponíveis.","Calça jeans moderna",taxable,50,89.90,79.90,Roupas > Calças,"jeans,masculino,casual",calca-002.jpg|calca-002-2.jpg,0.5,40,30,10
PROD-003,Tênis Esportivo Pro,simple,1,1,visible,"Tênis ideal para corrida e caminhada. Tecnologia de amortecimento avançada para máximo conforto.","Tênis para corrida",taxable,75,149.90,129.90,Calçados > Tênis,"esportivo,corrida,conforto",tenis-003.jpg|tenis-003-2.jpg|tenis-003-3.jpg,0.8,35,25,15
PROD-004,Bolsa de Couro Feminina,simple,1,1,visible,"Bolsa em couro legítimo com design elegante. Compartimentos internos organizados.","Bolsa de couro elegante",taxable,30,199.90,,Acessórios > Bolsas,"couro,feminino,elegante",bolsa-004.jpg,0.6,40,10,30
PROD-005,Relógio Digital Esportivo,simple,1,0,visible,"Relógio digital à prova d'água com cronômetro e alarme. Ideal para atividades ao ar livre.","Relógio à prova d'água",taxable,120,79.90,69.90,Acessórios > Relógios,"digital,esportivo,prova-dagua",relogio-005.jpg|relogio-005-2.jpg,0.1,25,5,5
